{
  "schemaVersion": "appspine.plugin/v1",
  "id": "identity-core",
  "displayName": "Identity Core",
  "cardinality": "singleton",
  "distribution": "official",
  "engine": {
    "appspinePluginApi": "^1.0.0",
    "node": ">=22.0.0",
    "frameworks": {
      "@nestjs/common": "^11.0.5",
      "@nestjs/core": "^11.0.5",
      "@prisma/client": "^6.2.0",
      "lucide-react": "^1.22.0",
      "react": "^19.0.0",
      "react-dom": "^19.0.0"
    }
  },
  "provides": ["appspine.identity-store"],
  "requires": ["appspine.prisma", "appspine.principal-context"],
  "optionalRequires": ["appspine.audit-sink"],
  "facets": {
    "backend": {
      "modulePath": "./dist/identity-core.module.js",
      "exportName": "IdentityCoreModule",
      "controllerRoutes": ["users"],
      "providerTokens": ["appspine.identity-store"]
    },
    "frontend": {
      "adminPages": [
        {
          "id": "users",
          "routePath": "/dashboard/users",
          "title": "users",
          "componentExport": "UsersTable",
          "requiredPermission": "identity:user:read",
          "order": 10
        }
      ],
      "navigationItems": [
        {
          "id": "users",
          "title": "users",
          "href": "/dashboard/users",
          "icon": "Users",
          "order": 10,
          "section": "admin",
          "requiredPermission": "identity:user:read"
        }
      ],
      "i18nNamespace": "users",
      "clientEntry": "./dist/frontend.js"
    },
    "prisma": {
      "owns": ["User"],
      "augmentedBy": [
        { "plugin": "rbac", "field": "userRoles" },
        { "plugin": "m2m-api-key", "field": "actingApiKeys" },
        { "plugin": "notification", "field": "notifications" }
      ],
      "schemaFragment": "prisma/user.prisma",
      "schemaDigest": "sha256:b47f2c095a634912f8fc2520c5d679b55599d1076e00295be0eb0efa2479530d"
    }
  }
}
