{
  "schemaVersion": "appspine.plugin/v1",
  "id": "health-check",
  "displayName": "Health Check",
  "cardinality": "singleton",
  "distribution": "official",
  "engine": {
    "appspinePluginApi": "^1.0.0",
    "node": ">=22.0.0",
    "frameworks": {
      "@nestjs/common": "^11.0.5",
      "@nestjs/core": "^11.0.5",
      "@prisma/client": "^6.2.0"
    }
  },
  "provides": ["appspine.health-indicator"],
  "requires": ["appspine.prisma"],
  "facets": {
    "backend": {
      "modulePath": "./dist/health.module.js",
      "exportName": "HealthModule",
      "controllerRoutes": ["health"]
    },
    "operations": {
      "healthIndicatorId": "health-check"
    }
  }
}
