{
  "schemaVersion": "appspine.plugin/v1",
  "id": "oidc-auth",
  "displayName": "OIDC Authentication",
  "cardinality": "singleton",
  "distribution": "official",
  "engine": {
    "appspinePluginApi": "^1.0.0",
    "node": ">=22.0.0",
    "frameworks": {
      "@nestjs/common": "^11.0.5",
      "@nestjs/core": "^11.0.5",
      "@prisma/client": "^6.2.0",
      "react": "^19.0.0",
      "react-dom": "^19.0.0"
    }
  },
  "provides": ["appspine.interactive-auth-provider", "appspine.delegated-identity-verifier"],
  "requires": [
    "appspine.identity-store",
    "appspine.authentication-strategy-registry",
    "appspine.principal-context",
    "appspine.prisma",
    "appspine.audit-sink"
  ],
  "optionalRequires": ["appspine.rbac-policy"],
  "conflicts": ["local-auth"],
  "configSchema": { "configRef": "oidc" },
  "environment": [
    { "key": "OIDC_ISSUER", "required": true, "secret": false },
    { "key": "OIDC_AUDIENCE", "required": true, "secret": false },
    { "key": "OIDC_JWKS_URL", "required": true, "secret": false }
  ],
  "facets": {
    "backend": {
      "modulePath": "./dist/oidc-auth.module.js",
      "exportName": "OidcAuthModule",
      "controllerRoutes": ["auth"]
    },
    "frontend": {
      "loginProviderUi": true,
      "i18nNamespace": "oidc-auth",
      "clientEntry": "./dist/frontend.js"
    },
    "prisma": {
      "owns": ["OidcIdentity"],
      "schemaFragment": "prisma/oidc-identity.prisma",
      "schemaDigest": "sha256:7f0cf0f5f74e87021cd49c654856223b0a1df7518cb53cac5a848cf9039dc45e"
    }
  }
}
