{
  "schemaVersion": "appspine.plugin/v1",
  "id": "domain-events",
  "displayName": "Domain Events",
  "cardinality": "singleton",
  "distribution": "official",
  "engine": {
    "appspinePluginApi": "^1.0.0",
    "node": ">=22.0.0",
    "frameworks": {
      "@nestjs/common": "^11.0.5",
      "@nestjs/core": "^11.0.5",
      "@prisma/client": "^6.2.0",
      "lucide-react": "^1.22.0",
      "react": "^19.0.0",
      "react-dom": "^19.0.0"
    }
  },
  "provides": ["appspine.domain-events"],
  "requires": ["appspine.prisma", "appspine.principal-context"],
  "optionalRequires": [
    "appspine.audit-sink",
    "appspine.machine-auth-provider",
    "appspine.rbac-policy"
  ],
  "facets": {
    "backend": {
      "modulePath": "./dist/admin/domain-events-admin.module.js",
      "exportName": "DomainEventsAdminModule",
      "controllerRoutes": ["domain-events"],
      "providerTokens": ["appspine.domain-events"]
    },
    "frontend": {
      "adminPages": [
        {
          "id": "domain-events",
          "routePath": "/dashboard/domain-events",
          "title": "domainEvents",
          "componentExport": "DomainEventsTable",
          "requiredPermission": "domain-events:event:read",
          "order": 40
        }
      ],
      "navigationItems": [
        {
          "id": "domain-events",
          "title": "domainEvents",
          "href": "/dashboard/domain-events",
          "icon": "Activity",
          "order": 40,
          "section": "admin",
          "requiredPermission": "domain-events:event:read",
          "after": "api-keys"
        }
      ],
      "i18nNamespace": "domainEvents",
      "clientEntry": "./dist/frontend.js"
    },
    "permissions": {
      "definitions": [
        "domain-events:event:read",
        "domain-events:event:retry",
        "domain-events:event:ignore"
      ]
    }
  }
}
